"Activity Date","Process Date","Settle Date","Instrument","Description","Trans Code","Quantity","Price","Amount"
"12/30/2025","12/30/2025","12/31/2025","VOO","Vanguard S&P 500 ETF
CUSIP: 922908363
Recurring","Buy","0.553324","$632.54","($350.00)"
"12/30/2025","12/30/2025","12/31/2025","COST","Costco
CUSIP: 22160K105","Buy","0.05","$862.72","($43.14)"
"12/26/2025","12/26/2025","12/26/2025","SMH","Cash Div: R/D 2025-12-22 P/D 2025-12-26 - 7.3 shares at 1.1047","CDIV","","","$8.06"
"12/26/2025","12/26/2025","12/26/2025","QQQM","Cash Div: R/D 2025-12-22 P/D 2025-12-26 - 262.330696 shares at 0.32301","CDIV","","","$84.74"
"12/26/2025","12/26/2025","12/26/2025","NVDA","Cash Div: R/D 2025-12-04 P/D 2025-12-26 - 42.5 shares at 0.01","CDIV","","","$0.43"
"12/26/2025","12/26/2025","12/29/2025","QQQM","Invesco Exchange-Traded Fund Trust II Invesco NASDAQ 100 ETF
CUSIP: 46138G649
Recurring","Buy","1.362344","$256.91","($350.00)"
"12/24/2025","12/24/2025","12/24/2025","VOO","Cash Div: R/D 2025-12-22 P/D 2025-12-24 - 122.212222 shares at 1.771","CDIV","","","$216.44"
"12/24/2025","12/24/2025","12/24/2025","TLT","Cash Div: R/D 2025-12-19 P/D 2025-12-24 - 17.042404 shares at 0.342437","CDIV","","","$5.84"
"12/24/2025","12/24/2025","12/26/2025","COST","Costco
CUSIP: 22160K105","Buy","0.05","$870.92","($43.55)"
"12/23/2025","12/23/2025","12/23/2025","META","Cash Div: R/D 2025-12-15 P/D 2025-12-23 - 7 shares at 0.525","CDIV","","","$3.68"
"12/23/2025","12/23/2025","12/24/2025","VOO","Vanguard S&P 500 ETF
CUSIP: 922908363
Recurring","Buy","0.553499","$632.34","($350.00)"
"12/23/2025","12/23/2025","12/24/2025","COST","Costco
CUSIP: 22160K105","Buy","0.1","$853.46","($85.35)"
"12/22/2025","12/22/2025","12/23/2025","MCD","McDonald's
CUSIP: 580135101","Sell","2","$317.60","$635.20"
"12/22/2025","12/22/2025","12/23/2025","","ACH Deposit","ACH","","","$1,400.00"
"12/22/2025","12/22/2025","12/23/2025","COST","Costco
CUSIP: 22160K105","Buy","0.1","$853.62","($85.36)"
"12/19/2025","12/19/2025","12/22/2025","QQQM","Invesco Exchange-Traded Fund Trust II Invesco NASDAQ 100 ETF
CUSIP: 46138G649
Recurring","Buy","1.377736","$254.04","($350.00)"
"12/19/2025","12/19/2025","12/22/2025","SGOV","iShares 0-3 Month Treasury Bond
CUSIP: 46436E718","Buy","50","$100.28","($5,013.75)"
"12/19/2025","12/19/2025","12/22/2025","","ACH Deposit","ACH","","","$5,000.00"
"12/19/2025","12/19/2025","12/22/2025","COST","Costco
CUSIP: 22160K105","Buy","0.1","$852.92","($85.29)"
"12/18/2025","12/18/2025","12/18/2025","HD","Cash Div: R/D 2025-12-04 P/D 2025-12-18 - 6.5 shares at 2.3","CDIV","","","$14.95"
"12/18/2025","12/18/2025","12/19/2025","COST","Costco
CUSIP: 22160K105","Buy","0.1","$860.90","($86.09)"
"12/17/2025","12/17/2025","12/18/2025","COST","Costco
CUSIP: 22160K105","Buy","0.1","$862.25","($86.23)"
"12/16/2025","12/16/2025","12/17/2025","VOO","Vanguard S&P 500 ETF
CUSIP: 922908363
Recurring","Buy","0.561365","$623.48","($350.00)"
"12/16/2025","12/16/2025","12/17/2025","COST","Costco
CUSIP: 22160K105","Buy","0.1","$850.59","($85.06)"
"12/15/2025","12/15/2025","12/15/2025","MCD","Cash Div: R/D 2025-12-01 P/D 2025-12-15 - 6 shares at 1.86","CDIV","","","$11.16"
"12/15/2025","12/15/2025","12/15/2025","GOOGL","Cash Div: R/D 2025-12-08 P/D 2025-12-15 - 10.5 shares at 0.21","CDIV","","","$2.21"
"12/15/2025","12/15/2025","12/16/2025","COST","Costco
CUSIP: 22160K105","Buy","0.1","$853.94","($85.39)"
"12/15/2025","12/15/2025","12/16/2025","COST","Costco
CUSIP: 22160K105","Buy","0.1","$867.98","($86.80)"
"12/15/2025","12/15/2025","12/16/2025","","ACH Deposit","ACH","","","$1,400.00"
"12/12/2025","12/12/2025","12/15/2025","QQQM","Invesco Exchange-Traded Fund Trust II Invesco NASDAQ 100 ETF
CUSIP: 46138G649
Recurring","Buy","1.378876","$253.83","($350.00)"
"12/12/2025","12/12/2025","12/15/2025","COST","Costco
CUSIP: 22160K105","Buy","0.1","$873.96","($87.40)"
"12/11/2025","12/11/2025","12/11/2025","MSFT","Cash Div: R/D 2025-11-20 P/D 2025-12-11 - 7.4 shares at 0.91","CDIV","","","$6.73"
"12/11/2025","12/11/2025","12/12/2025","COST","Costco
CUSIP: 22160K105","Buy","0.1","$875.13","($87.51)"
"12/10/2025","12/10/2025","12/11/2025","COST","Costco
CUSIP: 22160K105","Buy","0.1","$873.17","($87.32)"
"12/10/2025","12/10/2025","12/11/2025","COST","Costco
CUSIP: 22160K105","Buy","0.05","$884.80","($44.24)"
"12/9/2025","12/9/2025","12/10/2025","VOO","Vanguard S&P 500 ETF
CUSIP: 922908363
Recurring","Buy","0.476838","$629.14","($300.00)"
"12/9/2025","12/9/2025","12/10/2025","COST","Costco
CUSIP: 22160K105","Buy","0.05","$883.65","($44.18)"
"12/5/2025","12/5/2025","12/8/2025","QQQM","Invesco Exchange-Traded Fund Trust II Invesco NASDAQ 100 ETF
CUSIP: 46138G649
Recurring","Buy","1.163963","$257.74","($300.00)"
"12/4/2025","12/4/2025","12/4/2025","TLT","Cash Div: R/D 2025-12-01 P/D 2025-12-04 - 17.042404 shares at 0.320648","CDIV","","","$5.46"
"12/3/2025","12/3/2025","12/4/2025","","ACH Deposit","ACH","","","$1,200.00"
"12/2/2025","12/2/2025","12/3/2025","VOO","Vanguard S&P 500 ETF
CUSIP: 922908363
Recurring","Buy","0.479156","$626.10","($300.00)"
"11/28/2025","11/28/2025","12/1/2025","QQQM","Invesco Exchange-Traded Fund Trust II Invesco NASDAQ 100 ETF
CUSIP: 46138G649
Recurring","Buy","1.179662","$254.31","($300.00)"
"11/25/2025","11/25/2025","11/26/2025","VOO","Vanguard S&P 500 ETF
CUSIP: 922908363
Recurring","Buy","0.484027","$619.80","($300.00)"
"11/25/2025","11/25/2025","11/26/2025","PLTR","Palantir Technologies
CUSIP: 69608A108","Buy","0.1","$159.13","($15.91)"
"11/25/2025","11/25/2025","11/26/2025","MSFT","Microsoft
CUSIP: 594918104","Buy","0.1","$471.16","($47.12)"
"11/24/2025","11/24/2025","11/25/2025","MSFT","Microsoft
CUSIP: 594918104","Buy","0.1","$474.74","($47.47)"
"11/24/2025","11/24/2025","11/25/2025","COST","Costco
CUSIP: 22160K105","Buy","0.05","$890.86","($44.54)"
"11/24/2025","11/24/2025","11/25/2025","COST","Costco
CUSIP: 22160K105","Buy","0.05","$890.94","($44.55)"
"11/21/2025","11/21/2025","11/24/2025","QQQM","Invesco Exchange-Traded Fund Trust II Invesco NASDAQ 100 ETF
CUSIP: 46138G649
Recurring","Buy","1.234111","$243.09","($300.00)"
"11/21/2025","11/21/2025","11/24/2025","META","Meta Platforms
CUSIP: 30303M102","Buy","0.1","$584.90","($58.49)"
"11/21/2025","11/21/2025","11/24/2025","VOO","Vanguard S&P 500 ETF
CUSIP: 922908363","Buy","0.5","$599.57","($299.79)"
"11/21/2025","11/21/2025","11/24/2025","SMH","VanEck Semiconductor ETF
CUSIP: 92189F676","Buy","0.1","$316.58","($31.66)"
"11/21/2025","11/21/2025","11/24/2025","TSLA","Tesla
CUSIP: 88160R101","Buy","0.1","$386.08","($38.61)"
"11/21/2025","11/21/2025","11/24/2025","MSFT","Microsoft
CUSIP: 594918104","Buy","0.2","$471.81","($94.36)"
"11/20/2025","11/20/2025","11/21/2025","MSFT","Microsoft
CUSIP: 594918104","Buy","0.1","$479.24","($47.92)"
"11/20/2025","11/20/2025","11/21/2025","SMH","VanEck Semiconductor ETF
CUSIP: 92189F676","Buy","0.1","$328.81","($32.88)"
"11/20/2025","11/20/2025","11/21/2025","VOO","Vanguard S&P 500 ETF
CUSIP: 922908363","Buy","0.5","$604.06","($302.03)"
"11/20/2025","11/20/2025","11/21/2025","","ACH Deposit","ACH","","","$2,000.00"
"11/19/2025","11/19/2025","11/20/2025","META","Meta Platforms
CUSIP: 30303M102","Buy","0.2","$593.05","($118.61)"
"11/19/2025","11/19/2025","11/20/2025","MSFT","Microsoft
CUSIP: 594918104","Buy","0.2","$494.69","($98.94)"
"11/19/2025","11/19/2025","11/20/2025","HD","Home Depot
CUSIP: 437076102","Buy","0.4","$334.39","($133.76)"
"11/19/2025","11/19/2025","11/20/2025","COST","Costco
CUSIP: 22160K105","Buy","0.3","$882.97","($264.89)"
"11/18/2025","11/18/2025","11/19/2025","HD","Home Depot
CUSIP: 437076102","Buy","0.1","$337.76","($33.78)"
"11/18/2025","11/18/2025","11/19/2025","MSFT","Microsoft
CUSIP: 594918104","Buy","0.2","$494.95","($98.99)"
"11/18/2025","11/18/2025","11/19/2025","","ACH Deposit","ACH","","","$1,200.00"
"11/18/2025","11/18/2025","11/19/2025","COST","Costco
CUSIP: 22160K105","Buy","0.2","$895.92","($179.18)"
"11/18/2025","11/18/2025","11/19/2025","VOO","Vanguard S&P 500 ETF
CUSIP: 922908363
Recurring","Buy","0.491843","$609.95","($300.00)"
"11/17/2025","11/17/2025","11/18/2025","META","Meta Platforms
CUSIP: 30303M102","Buy","0.2","$600.29","($120.06)"
"11/17/2025","11/17/2025","11/18/2025","SMH","VanEck Semiconductor ETF
CUSIP: 92189F676","Buy","0.1","$339.72","($33.97)"
"11/14/2025","11/14/2025","11/14/2025","COST","Cash Div: R/D 2025-10-31 P/D 2025-11-14 - 2.15 shares at 1.3","CDIV","","","$2.80"
"11/14/2025","11/14/2025","11/17/2025","QQQM","Invesco Exchange-Traded Fund Trust II Invesco NASDAQ 100 ETF
CUSIP: 46138G649
Recurring","Buy","1.193476","$251.37","($300.00)"
"11/13/2025","11/13/2025","11/13/2025","AAPL","Cash Div: R/D 2025-11-10 P/D 2025-11-13 - 8.5 shares at 0.26","CDIV","","","$2.21"
"11/12/2025","11/12/2025","11/13/2025","META","Meta Platforms
CUSIP: 30303M102","Buy","0.1","$614.31","($61.43)"
"11/11/2025","11/11/2025","11/12/2025","VOO","Vanguard S&P 500 ETF
CUSIP: 922908363
Recurring","Buy","0.47771","$628.00","($300.00)"
"11/7/2025","11/7/2025","11/10/2025","QQQM","Invesco Exchange-Traded Fund Trust II Invesco NASDAQ 100 ETF
CUSIP: 46138G649
Recurring","Buy","1.206612","$248.63","($300.00)"
"11/6/2025","11/6/2025","11/6/2025","TLT","Cash Div: R/D 2025-11-03 P/D 2025-11-06 - 17.042404 shares at 0.325125","CDIV","","","$5.54"
"11/6/2025","11/6/2025","11/7/2025","","ACH Deposit","ACH","","","$1,200.00"
"11/5/2025","11/5/2025","11/6/2025","META","Meta Platforms
CUSIP: 30303M102","Buy","0.1","$637.78","($63.78)"
"11/4/2025","11/4/2025","11/5/2025","VOO","Vanguard S&P 500 ETF
CUSIP: 922908363
Recurring","Buy","0.482454","$621.82","($300.00)"
"11/4/2025","11/4/2025","11/5/2025","META","Meta Platforms
CUSIP: 30303M102","Buy","0.1","$629.48","($62.95)"
"11/3/2025","11/3/2025","11/4/2025","META","Meta Platforms
CUSIP: 30303M102","Buy","0.2","$643.45","($128.69)"
"10/31/2025","10/31/2025","11/3/2025","QQQM","Invesco Exchange-Traded Fund Trust II Invesco NASDAQ 100 ETF
CUSIP: 46138G649
Recurring","Buy","1.160755","$258.45","($300.00)"
"10/30/2025","10/30/2025","10/31/2025","","ACH Deposit","ACH","","","$1,200.00"
"10/30/2025","10/30/2025","10/31/2025","META","Meta Platforms
CUSIP: 30303M102","Buy","0.8","$657.98","($526.38)"
"10/28/2025","10/28/2025","10/29/2025","VOO","Vanguard S&P 500 ETF
CUSIP: 922908363
Recurring","Buy","0.47451","$632.23","($300.00)"
"10/27/2025","10/27/2025","10/28/2025","LULU","Lululemon
CUSIP: 550021109","Sell","2.603338","$183.95","$478.88"
"10/24/2025","10/24/2025","10/27/2025","QQQM","Invesco Exchange-Traded Fund Trust II Invesco NASDAQ 100 ETF
CUSIP: 46138G649
Recurring","Buy","1.179013","$254.45","($300.00)"
"10/21/2025","10/21/2025","10/22/2025","VOO","Vanguard S&P 500 ETF
CUSIP: 922908363
Recurring","Buy","0.485421","$618.02","($300.00)"
"10/17/2025","10/17/2025","10/20/2025","QQQM","Invesco Exchange-Traded Fund Trust II Invesco NASDAQ 100 ETF
CUSIP: 46138G649
Recurring","Buy","1.211299","$247.67","($300.00)"
"10/14/2025","10/14/2025","10/15/2025","VOO","Vanguard S&P 500 ETF
CUSIP: 922908363
Recurring","Buy","0.490777","$611.28","($300.00)"
"10/14/2025","10/14/2025","10/15/2025","","ACH Deposit","ACH","","","$1,200.00"
"10/10/2025","10/10/2025","10/14/2025","QQQM","Invesco Exchange-Traded Fund Trust II Invesco NASDAQ 100 ETF
CUSIP: 46138G649
Recurring","Buy","1.220504","$245.80","($300.00)"
"10/8/2025","10/8/2025","10/9/2025","","ACH Deposit","ACH","","","$600.00"
"10/7/2025","10/7/2025","10/8/2025","VOO","Vanguard S&P 500 ETF
CUSIP: 922908363
Recurring","Buy","0.488242","$614.45","($300.00)"
"10/6/2025","10/6/2025","10/6/2025","TLT","Cash Div: R/D 2025-10-01 P/D 2025-10-06 - 17.042404 shares at 0.310447","CDIV","","","$5.29"
"10/6/2025","10/6/2025","10/7/2025","COST","Costco
CUSIP: 22160K105","Buy","0.05","$908.24","($45.41)"
"10/3/2025","10/3/2025","10/6/2025","QQQM","Invesco Exchange-Traded Fund Trust II Invesco NASDAQ 100 ETF
CUSIP: 46138G649
Recurring","Buy","1.205305","$248.90","($300.00)"
"10/2/2025","10/2/2025","10/2/2025","NVDA","Cash Div: R/D 2025-09-11 P/D 2025-10-02 - 42.5 shares at 0.01","CDIV","","","$0.43"
"10/1/2025","10/1/2025","10/1/2025","VOO","Cash Div: R/D 2025-09-29 P/D 2025-10-01 - 115.327422 shares at 1.74","CDIV","","","$200.67"
"10/1/2025","10/1/2025","10/2/2025","COST","Costco
CUSIP: 22160K105","Buy","0.1","$911.30","($91.13)"
"9/30/2025","9/30/2025","10/1/2025","VOO","Vanguard S&P 500 ETF
CUSIP: 922908363
Recurring","Buy","0.492457","$609.19","($300.00)"
"9/30/2025","9/30/2025","10/1/2025","","ACH Deposit","ACH","","","$600.00"
"9/30/2025","9/30/2025","10/1/2025","COST","Costco
CUSIP: 22160K105","Buy","0.1","$920.95","($92.10)"
"9/29/2025","9/29/2025","9/29/2025","META","Cash Div: R/D 2025-09-22 P/D 2025-09-29 - 5.2 shares at 0.525","CDIV","","","$2.73"
"9/29/2025","9/29/2025","9/30/2025","COST","Costco
CUSIP: 22160K105","Buy","0.1","$907.49","($90.75)"
"9/26/2025","9/26/2025","9/26/2025","QQQM","Cash Div: R/D 2025-09-22 P/D 2025-09-26 - 246.395789 shares at 0.30245","CDIV","","","$74.52"
"9/26/2025","9/26/2025","9/29/2025","QQQM","Invesco Exchange-Traded Fund Trust II Invesco NASDAQ 100 ETF
CUSIP: 46138G649
Recurring","Buy","1.223595","$245.18","($300.00)"
"9/26/2025","9/26/2025","9/29/2025","COST","Costco
CUSIP: 22160K105","Buy","0.1","$923.54","($92.35)"
"9/23/2025","9/23/2025","9/24/2025","VOO","Vanguard S&P 500 ETF
CUSIP: 922908363
Recurring","Buy","0.490893","$611.13","($300.00)"
"9/23/2025","9/23/2025","9/24/2025","COST","Costco
CUSIP: 22160K105","Buy","0.1","$937.49","($93.75)"
"9/22/2025","9/22/2025","9/23/2025","COST","Costco
CUSIP: 22160K105","Buy","0.1","$941.44","($94.14)"
"9/22/2025","9/22/2025","9/23/2025","","ACH Deposit","ACH","","","$1,200.00"
"9/19/2025","9/19/2025","9/22/2025","QQQM","Invesco Exchange-Traded Fund Trust II Invesco NASDAQ 100 ETF
CUSIP: 46138G649
Recurring","Buy","1.217783","$246.35","($300.00)"
"9/18/2025","9/18/2025","9/18/2025","HD","Cash Div: R/D 2025-09-04 P/D 2025-09-18 - 6 shares at 2.3","CDIV","","","$13.80"
"9/16/2025","9/16/2025","9/16/2025","MCD","Cash Div: R/D 2025-09-02 P/D 2025-09-16 - 6 shares at 1.77","CDIV","","","$10.62"
"9/16/2025","9/16/2025","9/17/2025","VOO","Vanguard S&P 500 ETF
CUSIP: 922908363
Recurring","Buy","0.494316","$606.90","($300.00)"
"9/15/2025","9/15/2025","9/15/2025","GOOGL","Cash Div: R/D 2025-09-08 P/D 2025-09-15 - 10.5 shares at 0.21","CDIV","","","$2.21"
"9/12/2025","9/12/2025","9/15/2025","QQQM","Invesco Exchange-Traded Fund Trust II Invesco NASDAQ 100 ETF
CUSIP: 46138G649
Recurring","Buy","1.242348","$241.48","($300.00)"
"9/11/2025","9/11/2025","9/11/2025","MSFT","Cash Div: R/D 2025-08-21 P/D 2025-09-11 - 7 shares at 0.83","CDIV","","","$5.81"
"9/9/2025","9/9/2025","9/10/2025","VOO","Vanguard S&P 500 ETF
CUSIP: 922908363
Recurring","Buy","0.50215","$597.43","($300.00)"
"9/8/2025","9/8/2025","9/9/2025","","ACH Deposit","ACH","","","$1,000.00"
"9/5/2025","9/5/2025","9/5/2025","TLT","Cash Div: R/D 2025-09-02 P/D 2025-09-05 - 17.042404 shares at 0.328083","CDIV","","","$5.59"
"9/5/2025","9/5/2025","9/8/2025","QQQM","Invesco Exchange-Traded Fund Trust II Invesco NASDAQ 100 ETF
CUSIP: 46138G649
Recurring","Buy","1.267962","$236.60","($300.00)"
"9/2/2025","9/2/2025","9/3/2025","VOO","Vanguard S&P 500 ETF
CUSIP: 922908363
Recurring","Buy","0.51184","$586.12","($300.00)"
"8/29/2025","8/29/2025","9/2/2025","QQQM","Invesco Exchange-Traded Fund Trust II Invesco NASDAQ 100 ETF
CUSIP: 46138G649
Recurring","Buy","1.280573","$234.27","($300.00)"
"8/26/2025","8/26/2025","8/27/2025","VOO","Vanguard S&P 500 ETF
CUSIP: 922908363
Recurring","Buy","0.507579","$591.04","($300.00)"
"8/26/2025","8/26/2025","8/27/2025","COST","Costco
CUSIP: 22160K105","Buy","0.1","$937.66","($93.77)"
"8/25/2025","8/25/2025","8/26/2025","","ACH Deposit","ACH","","","$1,200.00"
"8/22/2025","8/22/2025","8/25/2025","QQQM","Invesco Exchange-Traded Fund Trust II Invesco NASDAQ 100 ETF
CUSIP: 46138G649
Recurring","Buy","1.271783","$235.89","($300.00)"
"8/19/2025","8/19/2025","8/20/2025","VOO","Vanguard S&P 500 ETF
CUSIP: 922908363
Recurring","Buy","0.510172","$588.04","($300.00)"
"8/15/2025","8/15/2025","8/15/2025","COST","Cash Div: R/D 2025-08-01 P/D 2025-08-15 - 1.4 shares at 1.3","CDIV","","","$1.82"
"8/15/2025","8/15/2025","8/18/2025","QQQM","Invesco Exchange-Traded Fund Trust II Invesco NASDAQ 100 ETF
CUSIP: 46138G649
Recurring","Buy","1.261511","$237.81","($300.00)"
"8/14/2025","8/14/2025","8/14/2025","AAPL","Cash Div: R/D 2025-08-11 P/D 2025-08-14 - 8.5 shares at 0.26","CDIV","","","$2.21"
"8/12/2025","8/12/2025","8/13/2025","VOO","Vanguard S&P 500 ETF
CUSIP: 922908363
Recurring","Buy","0.508233","$590.28","($300.00)"
"8/8/2025","8/8/2025","8/11/2025","","ACH Deposit","ACH","","","$1,200.00"
"8/8/2025","8/8/2025","8/11/2025","QQQM","Invesco Exchange-Traded Fund Trust II Invesco NASDAQ 100 ETF
CUSIP: 46138G649
Recurring","Buy","1.270276","$236.17","($300.00)"
"8/6/2025","8/6/2025","8/6/2025","TLT","Cash Div: R/D 2025-08-01 P/D 2025-08-06 - 17.042404 shares at 0.330802","CDIV","","","$5.64"
"8/5/2025","8/5/2025","8/6/2025","VOO","Vanguard S&P 500 ETF
CUSIP: 922908363
Recurring","Buy","0.518037","$579.11","($300.00)"
"8/1/2025","8/1/2025","8/4/2025","QQQM","Invesco Exchange-Traded Fund Trust II Invesco NASDAQ 100 ETF
CUSIP: 46138G649
Recurring","Buy","1.316024","$227.96","($300.00)"
"7/30/2025","7/30/2025","7/31/2025","","ACH Deposit","ACH","","","$1,200.00"
"7/30/2025","7/30/2025","7/31/2025","COST","Costco
CUSIP: 22160K105","Buy","0.2","$929.81","($185.96)"
"7/29/2025","7/29/2025","7/30/2025","VOO","Vanguard S&P 500 ETF
CUSIP: 922908363
Recurring","Buy","0.513445","$584.29","($300.00)"
"7/29/2025","7/29/2025","7/30/2025","COST","Costco
CUSIP: 22160K105","Buy","0.2","$932.30","($186.46)"
"7/28/2025","7/28/2025","7/29/2025","COST","Costco
CUSIP: 22160K105","Buy","0.5","$937.11","($468.56)"
"7/28/2025","7/28/2025","7/29/2025","","ACH Deposit","ACH","","","$1,200.00"
"7/25/2025","7/25/2025","7/28/2025","QQQM","Invesco Exchange-Traded Fund Trust II Invesco NASDAQ 100 ETF
CUSIP: 46138G649
Recurring","Buy","1.284961","$233.47","($300.00)"
"7/22/2025","7/22/2025","7/23/2025","VOO","Vanguard S&P 500 ETF
CUSIP: 922908363
Recurring","Buy","0.51921","$577.80","($300.00)"
"7/18/2025","7/18/2025","7/21/2025","QQQM","Invesco Exchange-Traded Fund Trust II Invesco NASDAQ 100 ETF
CUSIP: 46138G649
Recurring","Buy","1.298709","$231.00","($300.00)"
"7/15/2025","7/15/2025","7/16/2025","VOO","Vanguard S&P 500 ETF
CUSIP: 922908363
Recurring","Buy","0.522487","$574.18","($300.00)"
"7/15/2025","7/15/2025","7/16/2025","","ACH Deposit","ACH","","","$700.00"
"7/11/2025","7/11/2025","7/14/2025","QQQM","Invesco Exchange-Traded Fund Trust II Invesco NASDAQ 100 ETF
CUSIP: 46138G649
Recurring","Buy","1.312515","$228.57","($300.00)"
"7/8/2025","7/8/2025","7/9/2025","VOO","Vanguard S&P 500 ETF
CUSIP: 922908363
Recurring","Buy","0.525568","$570.81","($300.00)"
"7/7/2025","7/7/2025","7/7/2025","TLT","Cash Div: R/D 2025-07-01 P/D 2025-07-07 - 17.042404 shares at 0.328301","CDIV","","","$5.60"
"7/7/2025","7/7/2025","7/8/2025","QQQM","Invesco Exchange-Traded Fund Trust II Invesco NASDAQ 100 ETF
CUSIP: 46138G649
Recurring","Buy","1.321178","$227.07","($300.00)"
"7/3/2025","7/3/2025","7/3/2025","NVDA","Cash Div: R/D 2025-06-11 P/D 2025-07-03 - 42.5 shares at 0.01","CDIV","","","$0.43"
"7/2/2025","7/2/2025","7/2/2025","VOO","Cash Div: R/D 2025-06-30 P/D 2025-07-02 - 108.675277 shares at 1.7447","CDIV","","","$189.61"
"7/2/2025","7/2/2025","7/3/2025","","ACH Deposit","ACH","","","$800.00"
"7/1/2025","7/1/2025","7/2/2025","VOO","Vanguard S&P 500 ETF
CUSIP: 922908363
Recurring","Buy","0.528215","$567.95","($300.00)"
"6/27/2025","6/27/2025","6/27/2025","QQQM","Cash Div: R/D 2025-06-23 P/D 2025-06-27 - 229.722378 shares at 0.3161","CDIV","","","$72.62"
"6/27/2025","6/27/2025","6/30/2025","QQQM","Invesco Exchange-Traded Fund Trust II Invesco NASDAQ 100 ETF
CUSIP: 46138G649
Recurring","Buy","1.327788","$225.94","($300.00)"
"6/26/2025","6/26/2025","6/26/2025","META","Cash Div: R/D 2025-06-16 P/D 2025-06-26 - 5.2 shares at 0.525","CDIV","","","$2.73"
"6/24/2025","6/24/2025","6/25/2025","VOO","Vanguard S&P 500 ETF
CUSIP: 922908363
Recurring","Buy","0.536078","$559.62","($300.00)"
"6/23/2025","6/23/2025","6/24/2025","","ACH Deposit","ACH","","","$1,000.00"
"6/18/2025","6/18/2025","6/18/2025","HD","Cash Div: R/D 2025-06-05 P/D 2025-06-18 - 6 shares at 2.3","CDIV","","","$13.80"
"6/17/2025","6/17/2025","6/18/2025","VOO","Vanguard S&P 500 ETF
CUSIP: 922908363
Recurring","Buy","0.54484","$550.62","($300.00)"
"6/16/2025","6/16/2025","6/16/2025","MCD","Cash Div: R/D 2025-06-02 P/D 2025-06-16 - 6 shares at 1.77","CDIV","","","$10.62"
"6/16/2025","6/16/2025","6/16/2025","GOOGL","Cash Div: R/D 2025-06-09 P/D 2025-06-16 - 10.5 shares at 0.21","CDIV","","","$2.21"
"6/13/2025","6/13/2025","6/16/2025","QQQM","Invesco Exchange-Traded Fund Trust II Invesco NASDAQ 100 ETF
CUSIP: 46138G649
Recurring","Buy","1.374829","$218.21","($300.00)"
"6/12/2025","6/12/2025","6/12/2025","MSFT","Cash Div: R/D 2025-05-15 P/D 2025-06-12 - 7 shares at 0.83","CDIV","","","$5.81"
"6/10/2025","6/10/2025","6/11/2025","VOO","Vanguard S&P 500 ETF
CUSIP: 922908363
Recurring","Buy","0.542105","$553.40","($300.00)"
"6/9/2025","6/9/2025","6/10/2025","","ACH Deposit","ACH","","","$1,000.00"
"6/6/2025","6/6/2025","6/9/2025","QQQM","Invesco Exchange-Traded Fund Trust II Invesco NASDAQ 100 ETF
CUSIP: 46138G649
Recurring","Buy","1.373571","$218.41","($300.00)"
"6/5/2025","6/5/2025","6/5/2025","TLT","Cash Div: R/D 2025-06-02 P/D 2025-06-05 - 17.042404 shares at 0.319532","CDIV","","","$5.45"
"6/3/2025","6/3/2025","6/4/2025","VOO","Vanguard S&P 500 ETF
CUSIP: 922908363
Recurring","Buy","0.546936","$548.51","($300.00)"
"5/30/2025","5/30/2025","5/30/2025","","Interest Payment","INT","","","$0.01"
"5/30/2025","5/30/2025","6/2/2025","QQQM","Invesco Exchange-Traded Fund Trust II Invesco NASDAQ 100 ETF
CUSIP: 46138G649
Recurring","Buy","1.416097","$211.85","($300.00)"
"5/27/2025","5/27/2025","5/28/2025","VOO","Vanguard S&P 500 ETF
CUSIP: 922908363
Recurring","Buy","0.552457","$543.03","($300.00)"
"5/23/2025","5/23/2025","5/27/2025","QQQM","Invesco Exchange-Traded Fund Trust II Invesco NASDAQ 100 ETF
CUSIP: 46138G649
Recurring","Buy","1.425382","$210.47","($300.00)"
"5/20/2025","5/20/2025","5/21/2025","VOO","Vanguard S&P 500 ETF
CUSIP: 922908363
Recurring","Buy","0.550377","$545.08","($300.00)"
"5/16/2025","5/16/2025","5/16/2025","COST","Cash Div: R/D 2025-05-02 P/D 2025-05-16 - 0.5 shares at 1.3","CDIV","","","$0.65"
"5/16/2025","5/16/2025","5/19/2025","QQQM","Invesco Exchange-Traded Fund Trust II Invesco NASDAQ 100 ETF
CUSIP: 46138G649
Recurring","Buy","1.399776","$214.32","($300.00)"
"5/15/2025","5/15/2025","5/15/2025","AAPL","Cash Div: R/D 2025-05-12 P/D 2025-05-15 - 8.5 shares at 0.26","CDIV","","","$2.21"
"5/14/2025","5/14/2025","5/15/2025","TLT","iShares 20+ Year Treasury Bond ETF
CUSIP: 464287432","Buy","1","$85.40","($85.40)"
"5/13/2025","5/13/2025","5/14/2025","VOO","Vanguard S&P 500 ETF
CUSIP: 922908363
Recurring","Buy","0.554528","$541.00","($300.00)"
"5/9/2025","5/9/2025","5/12/2025","QQQM","Invesco Exchange-Traded Fund Trust II Invesco NASDAQ 100 ETF
CUSIP: 46138G649
Recurring","Buy","1.495513","$200.60","($300.00)"
"5/6/2025","5/6/2025","5/6/2025","TLT","Cash Div: R/D 2025-05-01 P/D 2025-05-06 - 16.042404 shares at 0.327612","CDIV","","","$5.26"
"5/6/2025","5/6/2025","5/7/2025","VOO","Vanguard S&P 500 ETF
CUSIP: 922908363
Recurring","Buy","0.58348","$514.16","($300.00)"
"5/2/2025","5/2/2025","5/5/2025","QQQM","Invesco Exchange-Traded Fund Trust II Invesco NASDAQ 100 ETF
CUSIP: 46138G649
Recurring","Buy","1.48701","$201.75","($300.00)"
"4/30/2025","4/30/2025","4/30/2025","","Interest Payment","INT","","","$7.47"
"4/30/2025","4/30/2025","5/1/2025","QQQM","Invesco Exchange-Traded Fund Trust II Invesco NASDAQ 100 ETF
CUSIP: 46138G649","Buy","1","$194.12","($194.12)"
"4/29/2025","4/29/2025","4/30/2025","VOO","Vanguard S&P 500 ETF
CUSIP: 922908363
Recurring","Buy","0.589344","$509.04","($300.00)"
"4/28/2025","4/28/2025","4/29/2025","QQQM","Invesco Exchange-Traded Fund Trust II Invesco NASDAQ 100 ETF
CUSIP: 46138G649","Buy","1","$193.58","($193.58)"
"4/25/2025","4/25/2025","4/28/2025","QQQM","Invesco Exchange-Traded Fund Trust II Invesco NASDAQ 100 ETF
CUSIP: 46138G649
Recurring","Buy","1.543408","$194.38","($300.00)"
"4/24/2025","4/24/2025","4/25/2025","QQQM","Invesco Exchange-Traded Fund Trust II Invesco NASDAQ 100 ETF
CUSIP: 46138G649","Buy","0.5","$189.94","($94.97)"
"4/24/2025","4/24/2025","4/25/2025","VOO","Vanguard S&P 500 ETF
CUSIP: 922908363","Buy","0.2","$496.32","($99.26)"
"4/23/2025","4/23/2025","4/24/2025","","ACH Deposit","ACH","","","$2,000.00"
"4/23/2025","4/23/2025","4/24/2025","QQQM","Invesco Exchange-Traded Fund Trust II Invesco NASDAQ 100 ETF
CUSIP: 46138G649","Buy","1","$190.45","($190.45)"
"4/22/2025","4/22/2025","4/23/2025","VOO","Vanguard S&P 500 ETF
CUSIP: 922908363
Recurring","Buy","0.624427","$480.44","($300.00)"
"4/22/2025","4/22/2025","4/23/2025","QQQM","Invesco Exchange-Traded Fund Trust II Invesco NASDAQ 100 ETF
CUSIP: 46138G649","Buy","1","$182.48","($182.49)"
"4/21/2025","4/21/2025","4/22/2025","QQQM","Invesco Exchange-Traded Fund Trust II Invesco NASDAQ 100 ETF
CUSIP: 46138G649
Recurring","Buy","1.695973","$176.89","($300.00)"
"4/21/2025","4/21/2025","4/22/2025","AMZN","Amazon
CUSIP: 023135106","Buy","0.5","$166.56","($83.28)"
"4/21/2025","4/21/2025","4/22/2025","MSFT","Microsoft
CUSIP: 594918104","Buy","0.2","$360.82","($72.16)"
"4/21/2025","4/21/2025","4/22/2025","VOO","Vanguard S&P 500 ETF
CUSIP: 922908363","Buy","0.6","$473.67","($284.20)"
"4/21/2025","4/21/2025","4/22/2025","QQQM","Invesco Exchange-Traded Fund Trust II Invesco NASDAQ 100 ETF
CUSIP: 46138G649","Buy","1","$178.44","($178.44)"
"4/21/2025","4/21/2025","4/22/2025","NVDA","NVIDIA
CUSIP: 67066G104","Buy","1","$95.77","($95.77)"
"4/17/2025","4/17/2025","4/21/2025","AMZN","Amazon
CUSIP: 023135106","Buy","0.2","$173.43","($34.69)"
"4/17/2025","4/17/2025","4/21/2025","SMH","VanEck Semiconductor ETF
CUSIP: 92189F676","Buy","0.2","$192.56","($38.51)"
"4/17/2025","4/17/2025","4/21/2025","QQQM","Invesco Exchange-Traded Fund Trust II Invesco NASDAQ 100 ETF
CUSIP: 46138G649","Buy","1","$182.71","($182.71)"
"4/17/2025","4/17/2025","4/21/2025","VOO","Vanguard S&P 500 ETF
CUSIP: 922908363","Buy","0.5","$484.74","($242.37)"
"4/16/2025","4/16/2025","4/17/2025","AMZN","Amazon
CUSIP: 023135106","Buy","0.3","$174.59","($52.38)"
"4/16/2025","4/16/2025","4/17/2025","META","Meta Platforms
CUSIP: 30303M102","Buy","0.2","$503.18","($100.64)"
"4/16/2025","4/16/2025","4/17/2025","QQQM","Invesco Exchange-Traded Fund Trust II Invesco NASDAQ 100 ETF
CUSIP: 46138G649","Buy","1","$183.14","($183.15)"
"4/16/2025","4/16/2025","4/17/2025","VOO","Vanguard S&P 500 ETF
CUSIP: 922908363","Buy","0.5","$484.51","($242.25)"
"4/15/2025","4/15/2025","4/15/2025","","Interest Payment","INT","","","$5.55"
"4/15/2025","4/15/2025","4/16/2025","VOO","Vanguard S&P 500 ETF
CUSIP: 922908363
Recurring","Buy","0.605913","$495.12","($300.00)"
"4/15/2025","4/15/2025","4/16/2025","","ACH Deposit","ACH","","","$2,000.00"
"4/15/2025","4/15/2025","4/16/2025","QQQM","Invesco Exchange-Traded Fund Trust II Invesco NASDAQ 100 ETF
CUSIP: 46138G649","Buy","1","$189.43","($189.43)"
"4/14/2025","4/14/2025","4/15/2025","VOO","Vanguard S&P 500 ETF
CUSIP: 922908363","Buy","0.2","$496.99","($99.40)"
"4/14/2025","4/14/2025","4/15/2025","QQQM","Invesco Exchange-Traded Fund Trust II Invesco NASDAQ 100 ETF
CUSIP: 46138G649","Buy","1","$189.58","($189.59)"
"4/11/2025","4/11/2025","4/14/2025","QQQM","Invesco Exchange-Traded Fund Trust II Invesco NASDAQ 100 ETF
CUSIP: 46138G649
Recurring","Buy","1.601366","$187.34","($300.00)"
"4/11/2025","4/11/2025","4/14/2025","VOO","Vanguard S&P 500 ETF
CUSIP: 922908363","Buy","0.6","$481.90","($289.14)"
"4/10/2025","4/10/2025","4/11/2025","QQQM","Invesco Exchange-Traded Fund Trust II Invesco NASDAQ 100 ETF
CUSIP: 46138G649","Buy","1","$184.88","($184.89)"
"4/10/2025","4/10/2025","4/11/2025","VOO","Vanguard S&P 500 ETF
CUSIP: 922908363","Buy","0.5","$487.41","($243.70)"
"4/9/2025","4/9/2025","4/10/2025","QQQM","Invesco Exchange-Traded Fund Trust II Invesco NASDAQ 100 ETF
CUSIP: 46138G649","Buy","1","$184.87","($184.87)"
"4/8/2025","4/8/2025","4/9/2025","VOO","Vanguard S&P 500 ETF
CUSIP: 922908363
Recurring","Buy","0.642402","$467.00","($300.00)"
"4/8/2025","4/8/2025","4/9/2025","VOO","Vanguard S&P 500 ETF
CUSIP: 922908363","Buy","0.4","$468.24","($187.30)"
"4/8/2025","4/8/2025","4/9/2025","AAPL","Apple
CUSIP: 037833100","Buy","0.2","$180.37","($36.07)"
"4/8/2025","4/8/2025","4/9/2025","QQQM","Invesco Exchange-Traded Fund Trust II Invesco NASDAQ 100 ETF
CUSIP: 46138G649","Buy","2","$176.19","($352.38)"
"4/7/2025","4/7/2025","4/8/2025","VOO","Vanguard S&P 500 ETF
CUSIP: 922908363","Buy","0.5","$465.22","($232.61)"
"4/7/2025","4/7/2025","4/8/2025","","ACH Deposit","ACH","","","$3,000.00"
"4/7/2025","4/7/2025","4/8/2025","","ACH Deposit","ACH","","","$2,000.00"
"4/7/2025","4/7/2025","4/8/2025","SMH","VanEck Semiconductor ETF
CUSIP: 92189F676","Buy","0.5","$179.65","($89.83)"
"4/7/2025","4/7/2025","4/8/2025","NVDA","NVIDIA
CUSIP: 67066G104","Buy","1","$93.36","($93.36)"
"4/7/2025","4/7/2025","4/8/2025","QQQM","Invesco Exchange-Traded Fund Trust II Invesco NASDAQ 100 ETF
CUSIP: 46138G649","Buy","3","$172.74","($518.22)"
"4/7/2025","4/7/2025","4/8/2025","VOO","Vanguard S&P 500 ETF
CUSIP: 922908363","Buy","1","$458.54","($458.54)"
"4/4/2025","4/4/2025","4/4/2025","TLT","Cash Div: R/D 2025-04-01 P/D 2025-04-04 - 16.042404 shares at 0.325582","CDIV","","","$5.22"
"4/4/2025","4/4/2025","4/7/2025","VOO","Vanguard S&P 500 ETF
CUSIP: 922908363","Buy","0.1","$466.22","($46.62)"
"4/4/2025","4/4/2025","4/7/2025","QQQM","Invesco Exchange-Traded Fund Trust II Invesco NASDAQ 100 ETF
CUSIP: 46138G649
Recurring","Buy","1.706872","$175.76","($300.00)"
"4/4/2025","4/4/2025","4/7/2025","","ACH Deposit","ACH","","","$1,000.00"
"4/4/2025","4/4/2025","4/7/2025","QQQM","Invesco Exchange-Traded Fund Trust II Invesco NASDAQ 100 ETF
CUSIP: 46138G649","Buy","1","$176.22","($176.22)"
"4/4/2025","4/4/2025","4/7/2025","LULU","Lululemon
CUSIP: 550021109","Buy","0.3","$240.35","($72.11)"
"4/4/2025","4/4/2025","4/7/2025","SMH","VanEck Semiconductor ETF
CUSIP: 92189F676","Buy","0.5","$183.64","($91.82)"
"4/4/2025","4/4/2025","4/7/2025","VOO","Vanguard S&P 500 ETF
CUSIP: 922908363","Buy","1","$476.37","($476.37)"
"4/4/2025","4/4/2025","4/7/2025","MSFT","Microsoft
CUSIP: 594918104","Buy","0.2","$371.06","($74.21)"
"4/4/2025","4/4/2025","4/7/2025","AMZN","Amazon
CUSIP: 023135106","Buy","0.5","$174.42","($87.21)"
"4/4/2025","4/4/2025","4/7/2025","META","Meta Platforms
CUSIP: 30303M102","Buy","0.3","$510.34","($153.10)"
"4/4/2025","4/4/2025","4/7/2025","QQQM","Invesco Exchange-Traded Fund Trust II Invesco NASDAQ 100 ETF
CUSIP: 46138G649","Buy","1","$179.31","($179.31)"
"4/4/2025","4/4/2025","4/7/2025","NVDA","NVIDIA
CUSIP: 67066G104","Buy","1","$96.11","($96.11)"
"4/3/2025","4/3/2025","4/4/2025","SMH","VanEck Semiconductor ETF
CUSIP: 92189F676","Buy","0.2","$197.18","($39.44)"
"4/3/2025","4/3/2025","4/4/2025","SMH","VanEck Semiconductor ETF
CUSIP: 92189F676","Buy","0.3","$197.38","($59.21)"
"4/3/2025","4/3/2025","4/4/2025","","ACH Deposit","ACH","","","$1,000.00"
"4/3/2025","4/3/2025","4/4/2025","AAPL","Apple
CUSIP: 037833100","Buy","0.1","$204.54","($20.45)"
"4/3/2025","4/3/2025","4/4/2025","AMZN","Amazon
CUSIP: 023135106","Buy","0.3","$178.86","($53.66)"
"4/3/2025","4/3/2025","4/4/2025","QQQM","Invesco Exchange-Traded Fund Trust II Invesco NASDAQ 100 ETF
CUSIP: 46138G649","Buy","2","$186.64","($373.28)"
"4/3/2025","4/3/2025","4/4/2025","VOO","Vanguard S&P 500 ETF
CUSIP: 922908363","Buy","1","$497.12","($497.12)"
"4/3/2025","4/3/2025","4/4/2025","META","Meta Platforms
CUSIP: 30303M102","Buy","0.1","$537.10","($53.71)"
"4/2/2025","4/2/2025","4/2/2025","NVDA","Cash Div: R/D 2025-03-12 P/D 2025-04-02 - 39.5 shares at 0.01","CDIV","","","$0.40"
"4/2/2025","4/2/2025","4/3/2025","QQQM","Invesco Exchange-Traded Fund Trust II Invesco NASDAQ 100 ETF
CUSIP: 46138G649","Buy","1","$195.59","($195.59)"
"4/1/2025","4/1/2025","4/2/2025","VOO","Vanguard S&P 500 ETF
CUSIP: 922908363
Recurring","Buy","0.583328","$514.29","($300.00)"
"4/1/2025","4/1/2025","4/2/2025","QQQM","Invesco Exchange-Traded Fund Trust II Invesco NASDAQ 100 ETF
CUSIP: 46138G649","Buy","1","$193.47","($193.47)"
"3/31/2025","3/31/2025","3/31/2025","VOO","Cash Div: R/D 2025-03-27 P/D 2025-03-31 - 92.519062 shares at 1.8121","CDIV","","","$167.65"
"3/31/2025","3/31/2025","3/31/2025","","Interest Payment","INT","","","$5.97"
"3/31/2025","3/31/2025","4/1/2025","","ACH Deposit","ACH","","","$1,000.00"
"3/31/2025","3/31/2025","4/1/2025","META","Meta Platforms
CUSIP: 30303M102","Buy","0.1","$561.99","($56.20)"
"3/31/2025","3/31/2025","4/1/2025","AMZN","Amazon
CUSIP: 023135106","Buy","0.2","$185.16","($37.03)"
"3/31/2025","3/31/2025","4/1/2025","MSFT","Microsoft
CUSIP: 594918104","Buy","0.3","$368.60","($110.58)"
"3/31/2025","3/31/2025","4/1/2025","QQQM","Invesco Exchange-Traded Fund Trust II Invesco NASDAQ 100 ETF
CUSIP: 46138G649","Buy","2","$189.79","($379.58)"
"3/31/2025","3/31/2025","4/1/2025","VOO","Vanguard S&P 500 ETF
CUSIP: 922908363","Buy","1","$506.60","($506.60)"
"3/31/2025","3/31/2025","3/31/2025","","Gold Subscription Fee","GOLD","","","($5.00)"
"3/28/2025","3/28/2025","3/28/2025","QQQM","Cash Div: R/D 2025-03-24 P/D 2025-03-28 - 184.148414 shares at 0.31763","CDIV","","","$58.49"
"3/28/2025","3/28/2025","3/28/2025","","Interest Payment","INT","","","$10.21"
"3/28/2025","3/28/2025","3/31/2025","MSFT","Microsoft
CUSIP: 594918104","Buy","0.2","$377.53","($75.51)"
"3/28/2025","3/28/2025","3/31/2025","VOO","Vanguard S&P 500 ETF
CUSIP: 922908363","Buy","0.6","$510.33","($306.20)"
"3/28/2025","3/28/2025","3/31/2025","QQQM","Invesco Exchange-Traded Fund Trust II Invesco NASDAQ 100 ETF
CUSIP: 46138G649","Buy","1","$192.86","($192.86)"
"3/28/2025","3/28/2025","3/31/2025","GOOGL","Alphabet Class A
CUSIP: 02079K305","Buy","0.2","$154.04","($30.81)"
"3/28/2025","3/28/2025","3/31/2025","QQQM","Invesco Exchange-Traded Fund Trust II Invesco NASDAQ 100 ETF
CUSIP: 46138G649
Recurring","Buy","1.554167","$193.03","($300.00)"
"3/28/2025","3/28/2025","3/31/2025","","ACH Deposit","ACH","","","$1,000.00"
"3/27/2025","3/27/2025","3/27/2025","HD","Cash Div: R/D 2025-03-13 P/D 2025-03-27 - 5.7 shares at 2.3","CDIV","","","$13.11"
"3/27/2025","3/27/2025","3/28/2025","QQQM","Invesco Exchange-Traded Fund Trust II Invesco NASDAQ 100 ETF
CUSIP: 46138G649","Buy","1","$199.09","($199.09)"
"3/26/2025","3/26/2025","3/26/2025","META","Cash Div: R/D 2025-03-14 P/D 2025-03-26 - 4.5 shares at 0.525","CDIV","","","$2.36"
"3/26/2025","3/26/2025","3/27/2025","VOO","Vanguard S&P 500 ETF
CUSIP: 922908363","Buy","0.5","$524.74","($262.37)"
"3/25/2025","3/25/2025","3/26/2025","VOO","Vanguard S&P 500 ETF
CUSIP: 922908363
Recurring","Buy","0.566315","$529.74","($300.00)"
"3/24/2025","3/24/2025","3/25/2025","QQQM","Invesco Exchange-Traded Fund Trust II Invesco NASDAQ 100 ETF
CUSIP: 46138G649","Buy","1","$201.66","($201.66)"
"3/21/2025","3/21/2025","3/24/2025","QQQM","Invesco Exchange-Traded Fund Trust II Invesco NASDAQ 100 ETF
CUSIP: 46138G649","Buy","1","$196.96","($196.96)"
"3/21/2025","3/21/2025","3/24/2025","QQQM","Invesco Exchange-Traded Fund Trust II Invesco NASDAQ 100 ETF
CUSIP: 46138G649
Recurring","Buy","1.521915","$197.12","($300.00)"
"3/21/2025","3/21/2025","3/24/2025","AAPL","Apple
CUSIP: 037833100","Buy","0.2","$214.21","($42.84)"
"3/21/2025","3/21/2025","3/24/2025","MSFT","Microsoft
CUSIP: 594918104","Buy","0.1","$383.95","($38.40)"
"3/21/2025","3/21/2025","3/24/2025","HD","Home Depot
CUSIP: 437076102","Buy","0.1","$349.04","($34.90)"
"3/21/2025","3/21/2025","3/24/2025","VOO","Vanguard S&P 500 ETF
CUSIP: 922908363","Buy","0.5","$516.61","($258.31)"
"3/20/2025","3/20/2025","3/21/2025","AAPL","Apple
CUSIP: 037833100","Buy","0.2","$212.56","($42.51)"
"3/20/2025","3/20/2025","3/21/2025","COST","Costco
CUSIP: 22160K105","Buy","0.1","$897.68","($89.77)"
"3/20/2025","3/20/2025","3/21/2025","QQQM","Invesco Exchange-Traded Fund Trust II Invesco NASDAQ 100 ETF
CUSIP: 46138G649","Buy","1","$198.88","($198.89)"
"3/20/2025","3/20/2025","3/21/2025","VOO","Vanguard S&P 500 ETF
CUSIP: 922908363","Buy","0.5","$523.65","($261.82)"
"3/20/2025","3/20/2025","3/21/2025","QQQM","Invesco Exchange-Traded Fund Trust II Invesco NASDAQ 100 ETF
CUSIP: 46138G649","Buy","1","$199.12","($199.12)"
"3/19/2025","3/19/2025","3/20/2025","","ACH Deposit","ACH","","","$2,000.00"
"3/18/2025","3/18/2025","3/19/2025","VOO","Vanguard S&P 500 ETF
CUSIP: 922908363
Recurring","Buy","0.581282","$516.10","($300.00)"
"3/18/2025","3/18/2025","3/19/2025","QQQM","Invesco Exchange-Traded Fund Trust II Invesco NASDAQ 100 ETF
CUSIP: 46138G649","Buy","1","$195.12","($195.12)"
"3/18/2025","3/18/2025","3/19/2025","HD","Home Depot
CUSIP: 437076102","Buy","0.2","$348.84","($69.77)"
"3/18/2025","3/18/2025","3/19/2025","QQQM","Invesco Exchange-Traded Fund Trust II Invesco NASDAQ 100 ETF
CUSIP: 46138G649","Buy","1","$195.30","($195.30)"
"3/18/2025","3/18/2025","3/19/2025","QQQM","Invesco Exchange-Traded Fund Trust II Invesco NASDAQ 100 ETF
CUSIP: 46138G649","Buy","1","$195.34","($195.34)"
"3/17/2025","3/17/2025","3/17/2025","GOOGL","Cash Div: R/D 2025-03-10 P/D 2025-03-17 - 10.3 shares at 0.2","CDIV","","","$2.06"
"3/17/2025","3/17/2025","3/17/2025","MCD","Cash Div: R/D 2025-03-03 P/D 2025-03-17 - 6 shares at 1.77","CDIV","","","$10.62"
"3/17/2025","3/17/2025","3/18/2025","QQQM","Invesco Exchange-Traded Fund Trust II Invesco NASDAQ 100 ETF
CUSIP: 46138G649","Buy","1","$198.23","($198.23)"
"3/17/2025","3/17/2025","3/18/2025","VOO","Vanguard S&P 500 ETF
CUSIP: 922908363","Buy","0.5","$520.13","($260.06)"
"3/17/2025","3/17/2025","3/18/2025","QQQM","Invesco Exchange-Traded Fund Trust II Invesco NASDAQ 100 ETF
CUSIP: 46138G649","Buy","1","$198.23","($198.23)"
"3/14/2025","3/14/2025","3/17/2025","QQQM","Invesco Exchange-Traded Fund Trust II Invesco NASDAQ 100 ETF
CUSIP: 46138G649
Recurring","Buy","1.523383","$196.93","($300.00)"
"3/14/2025","3/14/2025","3/17/2025","","ACH Deposit","ACH","","","$3,000.00"
"3/14/2025","3/14/2025","3/17/2025","VOO","Vanguard S&P 500 ETF
CUSIP: 922908363","Buy","0.5","$513.58","($256.79)"
"3/13/2025","3/13/2025","3/13/2025","MSFT","Cash Div: R/D 2025-02-20 P/D 2025-03-13 - 5.4 shares at 0.83","CDIV","","","$4.48"
"3/13/2025","3/13/2025","3/14/2025","","ACH Deposit","ACH","","","$1,000.00"
"3/13/2025","3/13/2025","3/14/2025","QQQM","Invesco Exchange-Traded Fund Trust II Invesco NASDAQ 100 ETF
CUSIP: 46138G649","Buy","1","$193.42","($193.42)"
"3/13/2025","3/13/2025","3/14/2025","VOO","Vanguard S&P 500 ETF
CUSIP: 922908363","Buy","0.5","$508.20","($254.10)"
"3/13/2025","3/13/2025","3/14/2025","COST","Costco
CUSIP: 22160K105","Buy","0.1","$894.92","($89.49)"
"3/13/2025","3/13/2025","3/14/2025","VOO","Vanguard S&P 500 ETF
CUSIP: 922908363","Buy","0.5","$512.80","($256.40)"
"3/13/2025","3/13/2025","3/14/2025","QQQM","Invesco Exchange-Traded Fund Trust II Invesco NASDAQ 100 ETF
CUSIP: 46138G649","Buy","1","$195.32","($195.32)"
"3/12/2025","3/12/2025","3/13/2025","COST","Costco
CUSIP: 22160K105","Buy","0.1","$928.32","($92.83)"
"3/12/2025","3/12/2025","3/13/2025","VOO","Vanguard S&P 500 ETF
CUSIP: 922908363","Buy","0.5","$511.25","($255.63)"
"3/12/2025","3/12/2025","3/13/2025","QQQM","Invesco Exchange-Traded Fund Trust II Invesco NASDAQ 100 ETF
CUSIP: 46138G649","Buy","1","$195.35","($195.35)"
"3/11/2025","3/11/2025","3/12/2025","","ACH Deposit","ACH","","","$1,000.00"
"3/11/2025","3/11/2025","3/12/2025","MSFT","Microsoft
CUSIP: 594918104","Buy","0.1","$378.71","($37.87)"
"3/11/2025","3/11/2025","3/12/2025","QQQM","Invesco Exchange-Traded Fund Trust II Invesco NASDAQ 100 ETF
CUSIP: 46138G649","Buy","1","$193.19","($193.19)"
"3/11/2025","3/11/2025","3/12/2025","VOO","Vanguard S&P 500 ETF
CUSIP: 922908363
Recurring","Buy","0.590719","$507.86","($300.00)"
"3/11/2025","3/11/2025","3/12/2025","QQQM","Invesco Exchange-Traded Fund Trust II Invesco NASDAQ 100 ETF
CUSIP: 46138G649","Buy","1","$194.44","($194.44)"
"3/11/2025","3/11/2025","3/12/2025","VOO","Vanguard S&P 500 ETF
CUSIP: 922908363","Buy","0.5","$512.70","($256.35)"
"3/10/2025","3/10/2025","3/11/2025","VOO","Vanguard S&P 500 ETF
CUSIP: 922908363","Buy","0.5","$513.64","($256.82)"
"3/10/2025","3/10/2025","3/11/2025","QQQM","Invesco Exchange-Traded Fund Trust II Invesco NASDAQ 100 ETF
CUSIP: 46138G649","Buy","2","$193.70","($387.39)"
"3/10/2025","3/10/2025","3/11/2025","TSLA","Tesla
CUSIP: 88160R101","Buy","0.5","$221.65","($110.82)"
"3/10/2025","3/10/2025","3/11/2025","MSFT","Microsoft
CUSIP: 594918104","Buy","0.1","$381.18","($38.12)"
"3/10/2025","3/10/2025","3/11/2025","TSLA","Tesla
CUSIP: 88160R101","Buy","0.4","$231.66","($92.66)"
"3/10/2025","3/10/2025","3/11/2025","","ACH Deposit","ACH","","","$1,000.00"
"3/10/2025","3/10/2025","3/11/2025","VOO","Vanguard S&P 500 ETF
CUSIP: 922908363","Buy","0.5","$518.80","($259.40)"
"3/10/2025","3/10/2025","3/11/2025","NVDA","NVIDIA
CUSIP: 67066G104","Buy","0.1","$106.83","($10.68)"
"3/10/2025","3/10/2025","3/11/2025","TSLA","Tesla
CUSIP: 88160R101","Buy","0.5","$241.17","($120.59)"
"3/10/2025","3/10/2025","3/11/2025","META","Meta Platforms
CUSIP: 30303M102","Buy","0.2","$594.00","($118.80)"
"3/10/2025","3/10/2025","3/11/2025","QQQM","Invesco Exchange-Traded Fund Trust II Invesco NASDAQ 100 ETF
CUSIP: 46138G649","Buy","3","$196.41","($589.23)"
"3/7/2025","3/7/2025","3/10/2025","QQQM","Invesco Exchange-Traded Fund Trust II Invesco NASDAQ 100 ETF
CUSIP: 46138G649
Recurring","Buy","1.49433","$200.76","($300.00)"
"3/7/2025","3/7/2025","3/10/2025","","ACH Deposit","ACH","","","$2,000.00"
"3/7/2025","3/7/2025","3/10/2025","QQQM","Invesco Exchange-Traded Fund Trust II Invesco NASDAQ 100 ETF
CUSIP: 46138G649","Buy","0.5","$200.35","($100.18)"
"3/7/2025","3/7/2025","3/10/2025","NVDA","NVIDIA
CUSIP: 67066G104","Buy","0.1","$111.02","($11.10)"
"3/7/2025","3/7/2025","3/10/2025","VOO","Vanguard S&P 500 ETF
CUSIP: 922908363","Buy","1","$524.37","($524.37)"
"3/7/2025","3/7/2025","3/10/2025","META","Meta Platforms
CUSIP: 30303M102","Buy","0.2","$615.16","($123.03)"
"3/7/2025","3/7/2025","3/10/2025","TSLA","Tesla
CUSIP: 88160R101","Buy","0.2","$259.42","($51.89)"
"3/6/2025","3/6/2025","3/6/2025","TLT","Cash Div: R/D 2025-03-03 P/D 2025-03-06 - 16.042404 shares at 0.289817","CDIV","","","$4.65"
"3/6/2025","3/6/2025","3/7/2025","SMH","VanEck Semiconductor ETF
CUSIP: 92189F676","Buy","0.1","$220.34","($22.03)"
"3/6/2025","3/6/2025","3/7/2025","NVDA","NVIDIA
CUSIP: 67066G104","Buy","0.1","$111.45","($11.14)"
"3/6/2025","3/6/2025","3/7/2025","QQQM","Invesco Exchange-Traded Fund Trust II Invesco NASDAQ 100 ETF
CUSIP: 46138G649","Buy","2","$201.58","($403.16)"
"3/6/2025","3/6/2025","3/7/2025","VOO","Vanguard S&P 500 ETF
CUSIP: 922908363","Buy","1","$526.04","($526.04)"
"3/6/2025","3/6/2025","3/7/2025","META","Meta Platforms
CUSIP: 30303M102","Buy","0.2","$632.62","($126.52)"
"3/6/2025","3/6/2025","3/7/2025","TSLA","Tesla
CUSIP: 88160R101","Buy","0.2","$263.22","($52.65)"
"3/5/2025","3/5/2025","3/6/2025","VOO","Vanguard S&P 500 ETF
CUSIP: 922908363","Buy","0.5","$532.48","($266.24)"
"3/5/2025","3/5/2025","3/6/2025","","ACH Deposit","ACH","","","$2,000.00"
"3/5/2025","3/5/2025","3/6/2025","META","Meta Platforms
CUSIP: 30303M102","Buy","0.1","$645.32","($64.53)"
"3/5/2025","3/5/2025","3/6/2025","QQQM","Invesco Exchange-Traded Fund Trust II Invesco NASDAQ 100 ETF
CUSIP: 46138G649","Buy","1","$204.15","($204.15)"
"3/5/2025","3/5/2025","3/6/2025","TSLA","Tesla
CUSIP: 88160R101","Buy","0.2","$273.38","($54.68)"
"3/4/2025","3/4/2025","3/5/2025","QQQM","Invesco Exchange-Traded Fund Trust II Invesco NASDAQ 100 ETF
CUSIP: 46138G649","Buy","1","$206.03","($206.03)"
"3/4/2025","3/4/2025","3/5/2025","VOO","Vanguard S&P 500 ETF
CUSIP: 922908363
Recurring","Buy","0.563337","$532.54","($300.00)"
"3/4/2025","3/4/2025","3/5/2025","META","Meta Platforms
CUSIP: 30303M102","Buy","0.3","$630.53","($189.16)"
"3/4/2025","3/4/2025","3/5/2025","META","Meta Platforms
CUSIP: 30303M102","Buy","0.2","$631.62","($126.32)"
"3/4/2025","3/4/2025","3/5/2025","SMH","VanEck Semiconductor ETF
CUSIP: 92189F676","Buy","0.2","$220.54","($44.11)"
"3/4/2025","3/4/2025","3/5/2025","MSFT","Microsoft
CUSIP: 594918104","Buy","0.1","$383.54","($38.35)"
"3/4/2025","3/4/2025","3/5/2025","META","Meta Platforms
CUSIP: 30303M102","Buy","0.1","$627.32","($62.73)"
"3/4/2025","3/4/2025","3/5/2025","NVDA","NVIDIA
CUSIP: 67066G104","Buy","0.1","$111.42","($11.14)"
"3/4/2025","3/4/2025","3/5/2025","QQQM","Invesco Exchange-Traded Fund Trust II Invesco NASDAQ 100 ETF
CUSIP: 46138G649","Buy","2","$201.84","($403.68)"
"3/4/2025","3/4/2025","3/5/2025","VOO","Vanguard S&P 500 ETF
CUSIP: 922908363","Buy","0.5","$528.64","($264.32)"
"3/4/2025","3/4/2025","3/5/2025","TSLA","Tesla
CUSIP: 88160R101","Buy","0.2","$265.45","($53.09)"
"3/3/2025","3/3/2025","3/4/2025","QQQM","Invesco Exchange-Traded Fund Trust II Invesco NASDAQ 100 ETF
CUSIP: 46138G649","Buy","0.5","$204.65","($102.32)"
"3/3/2025","3/3/2025","3/4/2025","SMH","VanEck Semiconductor ETF
CUSIP: 92189F676","Buy","0.1","$222.90","($22.29)"
"3/3/2025","3/3/2025","3/4/2025","NVDA","NVIDIA
CUSIP: 67066G104","Buy","0.1","$113.93","($11.39)"
"3/3/2025","3/3/2025","3/4/2025","META","Meta Platforms
CUSIP: 30303M102","Buy","0.1","$653.99","($65.40)"
"3/3/2025","3/3/2025","3/4/2025","TSLA","Tesla
CUSIP: 88160R101","Buy","0.1","$283.67","($28.37)"
"3/3/2025","3/3/2025","3/4/2025","VOO","Vanguard S&P 500 ETF
CUSIP: 922908363","Buy","0.5","$537.03","($268.51)"
"3/3/2025","3/3/2025","3/4/2025","QQQM","Invesco Exchange-Traded Fund Trust II Invesco NASDAQ 100 ETF
CUSIP: 46138G649","Buy","1","$206.81","($206.81)"
"3/3/2025","3/3/2025","3/4/2025","QQQM","Invesco Exchange-Traded Fund Trust II Invesco NASDAQ 100 ETF
CUSIP: 46138G649","Buy","1","$209.13","($209.13)"
"3/3/2025","3/3/2025","3/4/2025","VOO","Vanguard S&P 500 ETF
CUSIP: 922908363","Buy","0.5","$545.51","($272.75)"
"2/28/2025","2/28/2025","2/28/2025","","Interest Payment","INT","","","$19.75"
"2/28/2025","2/28/2025","3/3/2025","VOO","Vanguard S&P 500 ETF
CUSIP: 922908363","Buy","0.5","$537.78","($268.89)"
"2/28/2025","2/28/2025","3/3/2025","QQQM","Invesco Exchange-Traded Fund Trust II Invesco NASDAQ 100 ETF
CUSIP: 46138G649
Recurring","Buy","1.455865","$206.06","($300.00)"
"2/28/2025","2/28/2025","3/3/2025","","ACH Deposit","ACH","","","$3,000.00"
"2/28/2025","2/28/2025","3/3/2025","SMH","VanEck Semiconductor ETF
CUSIP: 92189F676","Buy","0.2","$231.52","($46.30)"
"2/28/2025","2/28/2025","3/3/2025","VOO","Vanguard S&P 500 ETF
CUSIP: 922908363","Buy","0.5","$540.20","($270.10)"
"2/28/2025","2/28/2025","3/3/2025","META","Meta Platforms
CUSIP: 30303M102","Buy","0.1","$660.92","($66.09)"
"2/28/2025","2/28/2025","3/3/2025","MSFT","Microsoft
CUSIP: 594918104","Buy","0.2","$391.59","($78.32)"
"2/28/2025","2/28/2025","3/3/2025","QQQM","Invesco Exchange-Traded Fund Trust II Invesco NASDAQ 100 ETF
CUSIP: 46138G649","Buy","1","$206.95","($206.95)"
"2/28/2025","2/28/2025","3/3/2025","TSLA","Tesla
CUSIP: 88160R101","Buy","0.1","$288.62","($28.86)"
"2/28/2025","2/28/2025","3/3/2025","MSFT","Microsoft
CUSIP: 594918104","Buy","0.1","$391.68","($39.17)"
"2/28/2025","2/28/2025","3/3/2025","VOO","Vanguard S&P 500 ETF
CUSIP: 922908363","Buy","0.5","$540.94","($270.47)"
"2/28/2025","2/28/2025","2/28/2025","","Gold Subscription Fee","GOLD","","","($5.00)"
"2/27/2025","2/27/2025","2/28/2025","QQQM","Invesco Exchange-Traded Fund Trust II Invesco NASDAQ 100 ETF
CUSIP: 46138G649","Buy","2","$206.88","($413.76)"
"2/27/2025","2/27/2025","2/28/2025","VOO","Vanguard S&P 500 ETF
CUSIP: 922908363","Buy","1","$539.63","($539.63)"
"2/27/2025","2/27/2025","2/28/2025","TSLA","Tesla
CUSIP: 88160R101","Buy","0.1","$283.94","($28.39)"
"2/27/2025","2/27/2025","2/28/2025","","ACH Deposit","ACH","","","$2,000.00"
"2/27/2025","2/27/2025","2/28/2025","VOO","Vanguard S&P 500 ETF
CUSIP: 922908363","Buy","0.5","$545.00","($272.50)"
"2/27/2025","2/27/2025","2/28/2025","TSLA","Tesla
CUSIP: 88160R101","Buy","0.1","$287.20","($28.72)"
"2/27/2025","2/27/2025","2/28/2025","VOO","Vanguard S&P 500 ETF
CUSIP: 922908363","Buy","0.5","$546.50","($273.25)"
"2/27/2025","2/27/2025","2/28/2025","QQQM","Invesco Exchange-Traded Fund Trust II Invesco NASDAQ 100 ETF
CUSIP: 46138G649","Buy","2","$210.51","($421.02)"
"2/26/2025","2/26/2025","2/27/2025","TSLA","Tesla
CUSIP: 88160R101","Buy","0.1","$300.40","($30.04)"
"2/26/2025","2/26/2025","2/27/2025","QQQM","Invesco Exchange-Traded Fund Trust II Invesco NASDAQ 100 ETF
CUSIP: 46138G649","Buy","1","$212.86","($212.86)"
"2/26/2025","2/26/2025","2/27/2025","VOO","Vanguard S&P 500 ETF
CUSIP: 922908363","Buy","0.5","$549.90","($274.95)"
"2/25/2025","2/25/2025","2/26/2025","VOO","Vanguard S&P 500 ETF
CUSIP: 922908363
Recurring","Buy","0.547695","$547.75","($300.00)"
"2/25/2025","2/25/2025","2/26/2025","QQQM","Invesco Exchange-Traded Fund Trust II Invesco NASDAQ 100 ETF
CUSIP: 46138G649","Buy","1","$211.78","($211.78)"
"2/25/2025","2/25/2025","2/26/2025","VOO","Vanguard S&P 500 ETF
CUSIP: 922908363","Buy","0.5","$544.77","($272.38)"
"2/25/2025","2/25/2025","2/26/2025","VOO","Vanguard S&P 500 ETF
CUSIP: 922908363","Buy","0.5","$544.45","($272.23)"
"2/25/2025","2/25/2025","2/26/2025","QQQM","Invesco Exchange-Traded Fund Trust II Invesco NASDAQ 100 ETF
CUSIP: 46138G649","Buy","1","$210.73","($210.73)"
"2/25/2025","2/25/2025","2/26/2025","TSLA","Tesla
CUSIP: 88160R101","Buy","0.2","$303.04","($60.61)"
"2/24/2025","2/24/2025","2/25/2025","","ACH Deposit","ACH","","","$2,000.00"
"2/24/2025","2/24/2025","2/25/2025","QQQM","Invesco Exchange-Traded Fund Trust II Invesco NASDAQ 100 ETF
CUSIP: 46138G649","Buy","1","$214.70","($214.70)"
"2/24/2025","2/24/2025","2/25/2025","VOO","Vanguard S&P 500 ETF
CUSIP: 922908363","Buy","1","$548.90","($548.90)"
"2/24/2025","2/24/2025","2/25/2025","TSLA","Tesla
CUSIP: 88160R101","Buy","0.2","$328.10","($65.62)"
"2/21/2025","2/21/2025","2/21/2025","COST","Cash Div: R/D 2025-02-07 P/D 2025-02-21 - 0.2 shares at 1.16","CDIV","","","$0.23"
"2/21/2025","2/21/2025","2/24/2025","VOO","Vanguard S&P 500 ETF
CUSIP: 922908363","Buy","1","$551.46","($551.46)"
"2/21/2025","2/21/2025","2/21/2025","","Cash reward","MISC","","","$5.00"
"2/21/2025","2/21/2025","2/24/2025","","ACH Deposit","ACH","","","$3,000.00"
"2/21/2025","2/21/2025","2/24/2025","QQQM","Invesco Exchange-Traded Fund Trust II Invesco NASDAQ 100 ETF
CUSIP: 46138G649","Buy","2","$216.82","($433.64)"
"2/21/2025","2/21/2025","2/24/2025","VOO","Vanguard S&P 500 ETF
CUSIP: 922908363","Buy","2","$552.05","($1,104.10)"
"2/21/2025","2/21/2025","2/24/2025","GOOGL","Alphabet Class A
CUSIP: 02079K305","Buy","0.1","$179.56","($17.96)"
"2/21/2025","2/21/2025","2/24/2025","TSLA","Tesla
CUSIP: 88160R101","Buy","0.3","$336.40","($100.92)"
"2/21/2025","2/21/2025","2/24/2025","QQQM","Invesco Exchange-Traded Fund Trust II Invesco NASDAQ 100 ETF
CUSIP: 46138G649
Recurring","Buy","1.377922","$217.72","($300.00)"
"2/18/2025","2/18/2025","2/19/2025","VOO","Vanguard S&P 500 ETF
CUSIP: 922908363
Recurring","Buy","0.534916","$560.84","($300.00)"
"2/14/2025","2/14/2025","2/18/2025","QQQM","Invesco Exchange-Traded Fund Trust II Invesco NASDAQ 100 ETF
CUSIP: 46138G649
Recurring","Buy","1.355753","$221.28","($300.00)"
"2/13/2025","2/13/2025","2/13/2025","AAPL","Cash Div: R/D 2025-02-10 P/D 2025-02-13 - 7.8 shares at 0.25","CDIV","","","$1.95"
"2/13/2025","2/13/2025","2/14/2025","GOOGL","Alphabet Class A
CUSIP: 02079K305","Buy","0.2","$184.22","($36.84)"
"2/12/2025","2/12/2025","2/13/2025","QQQM","Invesco Exchange-Traded Fund Trust II Invesco NASDAQ 100 ETF
CUSIP: 46138G649","Buy","0.5","$216.32","($108.16)"
"2/12/2025","2/12/2025","2/13/2025","MSFT","Microsoft
CUSIP: 594918104","Buy","0.2","$407.66","($81.53)"
"2/12/2025","2/12/2025","2/13/2025","VOO","Vanguard S&P 500 ETF
CUSIP: 922908363","Buy","0.5","$552.55","($276.28)"
"2/12/2025","2/12/2025","2/13/2025","TSLA","Tesla
CUSIP: 88160R101","Buy","0.1","$337.77","($33.78)"
"2/11/2025","2/11/2025","2/12/2025","VOO","Vanguard S&P 500 ETF
CUSIP: 922908363","Buy","0.2","$555.95","($111.19)"
"2/10/2025","2/10/2025","2/11/2025","VOO","Vanguard S&P 500 ETF
CUSIP: 922908363
Recurring","Buy","0.539442","$556.13","($300.00)"
"2/10/2025","2/10/2025","2/11/2025","","ACH Deposit","ACH","","","$2,000.00"
"2/6/2025","2/6/2025","2/6/2025","TLT","Cash Div: R/D 2025-02-03 P/D 2025-02-06 - 16.042404 shares at 0.312282","CDIV","","","$5.01"
"2/6/2025","2/6/2025","2/7/2025","QQQM","Invesco Exchange-Traded Fund Trust II Invesco NASDAQ 100 ETF
CUSIP: 46138G649
Recurring","Buy","1.378169","$217.68","($300.00)"
"2/6/2025","2/6/2025","2/7/2025","","ACH Deposit","ACH","","","$300.00"
"2/4/2025","2/4/2025","2/5/2025","VOO","Vanguard S&P 500 ETF
CUSIP: 922908363","Buy","0.5","$552.50","($276.25)"
"2/3/2025","2/3/2025","2/4/2025","VOO","Vanguard S&P 500 ETF
CUSIP: 922908363
Recurring","Buy","0.545069","$550.39","($300.00)"
"2/3/2025","2/3/2025","2/4/2025","","ACH Deposit","ACH","","","$300.00"
"2/3/2025","2/3/2025","2/4/2025","QQQM","Invesco Exchange-Traded Fund Trust II Invesco NASDAQ 100 ETF
CUSIP: 46138G649","Buy","0.5","$213.33","($106.66)"
"2/3/2025","2/3/2025","2/4/2025","VOO","Vanguard S&P 500 ETF
CUSIP: 922908363","Buy","0.1","$549.14","($54.91)"
"2/3/2025","2/3/2025","2/4/2025","MSFT","Microsoft
CUSIP: 594918104","Buy","0.2","$412.94","($82.59)"
"1/31/2025","1/31/2025","1/31/2025","","Interest Payment","INT","","","$31.14"
"1/30/2025","1/30/2025","1/31/2025","QQQM","Invesco Exchange-Traded Fund Trust II Invesco NASDAQ 100 ETF
CUSIP: 46138G649
Recurring","Buy","1.397303","$214.70","($300.00)"
"1/30/2025","1/30/2025","1/31/2025","","ACH Deposit","ACH","","","$300.00"
"1/30/2025","1/30/2025","1/31/2025","NVDA","NVIDIA
CUSIP: 67066G104","Buy","0.5","$118.41","($59.20)"
"1/30/2025","1/30/2025","1/30/2025","","Gold Subscription Fee","GOLD","","","($5.00)"
"1/28/2025","1/28/2025","1/29/2025","VOO","Vanguard S&P 500 ETF
CUSIP: 922908363","Buy","0.2","$554.68","($110.94)"
"1/28/2025","1/28/2025","1/29/2025","QQQM","Invesco Exchange-Traded Fund Trust II Invesco NASDAQ 100 ETF
CUSIP: 46138G649","Buy","1","$213.57","($213.57)"
"1/28/2025","1/28/2025","1/29/2025","NVDA","NVIDIA
CUSIP: 67066G104","Buy","1","$119.86","($119.87)"
"1/27/2025","1/27/2025","1/28/2025","QQQM","Invesco Exchange-Traded Fund Trust II Invesco NASDAQ 100 ETF
CUSIP: 46138G649","Buy","1","$210.61","($210.61)"
"1/27/2025","1/27/2025","1/28/2025","NVDA","NVIDIA
CUSIP: 67066G104","Buy","2","$118.34","($236.68)"
"1/27/2025","1/27/2025","1/28/2025","VOO","Vanguard S&P 500 ETF
CUSIP: 922908363
Recurring","Buy","0.546942","$548.50","($300.00)"
"1/27/2025","1/27/2025","1/28/2025","SMH","VanEck Semiconductor ETF
CUSIP: 92189F676","Buy","1","$235.00","($235.00)"
"1/27/2025","1/27/2025","1/28/2025","","ACH Deposit","ACH","","","$300.00"
"1/27/2025","1/27/2025","1/28/2025","NVDA","NVIDIA
CUSIP: 67066G104","Buy","2","$120.00","($240.00)"
"1/27/2025","1/27/2025","1/28/2025","QQQM","Invesco Exchange-Traded Fund Trust II Invesco NASDAQ 100 ETF
CUSIP: 46138G649","Buy","1","$211.75","($211.75)"
"1/27/2025","1/27/2025","1/28/2025","NVDA","NVIDIA
CUSIP: 67066G104","Buy","1","$120.85","($120.85)"
"1/27/2025","1/27/2025","1/28/2025","SMH","VanEck Semiconductor ETF
CUSIP: 92189F676","Buy","1","$238.50","($238.50)"
"1/27/2025","1/27/2025","1/28/2025","QQQM","Invesco Exchange-Traded Fund Trust II Invesco NASDAQ 100 ETF
CUSIP: 46138G649","Buy","2","$211.92","($423.84)"
"1/27/2025","1/27/2025","1/28/2025","NVDA","NVIDIA
CUSIP: 67066G104","Buy","2","$122.07","($244.14)"
"1/23/2025","1/23/2025","1/24/2025","QQQM","Invesco Exchange-Traded Fund Trust II Invesco NASDAQ 100 ETF
CUSIP: 46138G649
Recurring","Buy","1.372872","$218.52","($300.00)"
"1/23/2025","1/23/2025","1/24/2025","","ACH Deposit","ACH","","","$300.00"
"1/23/2025","1/23/2025","1/24/2025","AAPL","Apple
CUSIP: 037833100","Buy","0.4","$225.09","($90.04)"
"1/21/2025","1/21/2025","1/22/2025","VOO","Vanguard S&P 500 ETF
CUSIP: 922908363
Recurring","Buy","0.541711","$553.80","($300.00)"
"1/21/2025","1/21/2025","1/22/2025","TLT","iShares 20+ Year Treasury Bond ETF
CUSIP: 464287432
Recurring","Buy","0.113966","$87.74","($10.00)"
"1/21/2025","1/21/2025","1/22/2025","","ACH Deposit","ACH","","","$300.00"
"1/17/2025","1/17/2025","1/21/2025","TLT","iShares 20+ Year Treasury Bond ETF
CUSIP: 464287432
Recurring","Buy","0.114678","$87.20","($10.00)"
"1/16/2025","1/16/2025","1/17/2025","TLT","iShares 20+ Year Treasury Bond ETF
CUSIP: 464287432
Recurring","Buy","0.11483","$87.08","($10.00)"
"1/16/2025","1/16/2025","1/17/2025","QQQM","Invesco Exchange-Traded Fund Trust II Invesco NASDAQ 100 ETF
CUSIP: 46138G649
Recurring","Buy","1.414527","$212.08","($300.00)"
"1/16/2025","1/16/2025","1/17/2025","","ACH Deposit","ACH","","","$300.00"
"1/15/2025","1/15/2025","1/16/2025","TLT","iShares 20+ Year Treasury Bond ETF
CUSIP: 464287432
Recurring","Buy","0.115446","$86.62","($10.00)"
"1/14/2025","1/14/2025","1/15/2025","VOO","Vanguard S&P 500 ETF
CUSIP: 922908363","Buy","0.4","$532.68","($213.07)"
"1/14/2025","1/14/2025","1/15/2025","MSFT","Microsoft
CUSIP: 594918104","Buy","0.1","$413.41","($41.34)"
"1/14/2025","1/14/2025","1/15/2025","MCD","McDonald's
CUSIP: 580135101","Buy","0.1","$279.74","($27.97)"
"1/14/2025","1/14/2025","1/15/2025","NVDA","NVIDIA
CUSIP: 67066G104","Buy","0.1","$130.50","($13.05)"
"1/14/2025","1/14/2025","1/15/2025","TLT","iShares 20+ Year Treasury Bond ETF
CUSIP: 464287432
Recurring","Buy","0.11757","$85.06","($10.00)"
"1/14/2025","1/14/2025","1/15/2025","QQQM","Invesco Exchange-Traded Fund Trust II Invesco NASDAQ 100 ETF
CUSIP: 46138G649","Buy","1","$207.81","($207.81)"
"1/13/2025","1/13/2025","1/14/2025","TLT","iShares 20+ Year Treasury Bond ETF
CUSIP: 464287432
Recurring","Buy","0.11706","$85.43","($10.00)"
"1/13/2025","1/13/2025","1/14/2025","VOO","Vanguard S&P 500 ETF
CUSIP: 922908363
Recurring","Buy","0.562641","$533.20","($300.00)"
"1/13/2025","1/13/2025","1/14/2025","VOO","Vanguard S&P 500 ETF
CUSIP: 922908363","Buy","0.4","$532.44","($212.98)"
"1/13/2025","1/13/2025","1/14/2025","","ACH Deposit","ACH","","","$300.00"
"1/13/2025","1/13/2025","1/14/2025","VOO","Vanguard S&P 500 ETF
CUSIP: 922908363","Buy","0.4","$530.66","($212.26)"
"1/13/2025","1/13/2025","1/14/2025","QQQM","Invesco Exchange-Traded Fund Trust II Invesco NASDAQ 100 ETF
CUSIP: 46138G649","Buy","2","$206.32","($412.64)"
"1/10/2025","1/10/2025","1/13/2025","TLT","iShares 20+ Year Treasury Bond ETF
CUSIP: 464287432
Recurring","Buy","0.117045","$85.44","($10.00)"
"1/10/2025","1/10/2025","1/13/2025","QQQM","Invesco Exchange-Traded Fund Trust II Invesco NASDAQ 100 ETF
CUSIP: 46138G649
Recurring","Buy","1.431297","$209.60","($300.00)"
"1/10/2025","1/10/2025","1/13/2025","","ACH Deposit","ACH","","","$300.00"
"1/10/2025","1/10/2025","1/13/2025","VOO","Vanguard S&P 500 ETF
CUSIP: 922908363","Buy","0.5","$534.40","($267.20)"
"1/10/2025","1/10/2025","1/13/2025","MSFT","Microsoft
CUSIP: 594918104","Buy","0.2","$418.10","($83.62)"
"1/8/2025","1/8/2025","1/9/2025","VOO","Vanguard S&P 500 ETF
CUSIP: 922908363","Buy","0.4","$540.43","($216.17)"
"1/8/2025","1/8/2025","1/9/2025","TLT","iShares 20+ Year Treasury Bond ETF
CUSIP: 464287432
Recurring","Buy","0.116458","$85.87","($10.00)"
"1/8/2025","1/8/2025","1/9/2025","HD","Home Depot
CUSIP: 437076102","Buy","0.1","$382.46","($38.25)"
"1/8/2025","1/8/2025","1/9/2025","QQQM","Invesco Exchange-Traded Fund Trust II Invesco NASDAQ 100 ETF
CUSIP: 46138G649","Buy","1","$211.55","($211.55)"
"1/7/2025","1/7/2025","1/8/2025","TLT","iShares 20+ Year Treasury Bond ETF
CUSIP: 464287432
Recurring","Buy","0.116364","$85.94","($10.00)"
"1/7/2025","1/7/2025","1/8/2025","QQQM","Invesco Exchange-Traded Fund Trust II Invesco NASDAQ 100 ETF
CUSIP: 46138G649","Buy","0.5","$213.31","($106.65)"
"1/7/2025","1/7/2025","1/8/2025","HD","Home Depot
CUSIP: 437076102","Buy","0.1","$385.48","($38.55)"
"1/6/2025","1/6/2025","1/7/2025","HD","Home Depot
CUSIP: 437076102","Buy","0.1","$389.38","($38.94)"
"1/6/2025","1/6/2025","1/7/2025","TLT","iShares 20+ Year Treasury Bond ETF
CUSIP: 464287432
Recurring","Buy","0.115141","$86.85","($10.00)"
"1/6/2025","1/6/2025","1/7/2025","VOO","Vanguard S&P 500 ETF
CUSIP: 922908363
Recurring","Buy","0.546599","$548.85","($300.00)"
"1/6/2025","1/6/2025","1/7/2025","","ACH Deposit","ACH","","","$300.00"
"1/3/2025","1/3/2025","1/6/2025","TLT","iShares 20+ Year Treasury Bond ETF
CUSIP: 464287432
Recurring","Buy","0.114279","$87.50","($10.00)"
"1/3/2025","1/3/2025","1/6/2025","UBER","Uber
CUSIP: 90353T100
Recurring","Buy","0.154202","$64.85","($10.00)"
"1/3/2025","1/3/2025","1/6/2025","","ACH Deposit","ACH","","","$10.00"
"1/2/2025","1/2/2025","1/3/2025","HD","Home Depot
CUSIP: 437076102","Buy","0.1","$387.62","($38.76)"
"1/2/2025","1/2/2025","1/3/2025","TLT","iShares 20+ Year Treasury Bond ETF
CUSIP: 464287432
Recurring","Buy","0.114239","$87.54","($10.00)"
"1/2/2025","1/2/2025","1/3/2025","UBER","Uber
CUSIP: 90353T100
Recurring","Buy","0.160453","$62.32","($10.00)"
"1/2/2025","1/2/2025","1/3/2025","QQQM","Invesco Exchange-Traded Fund Trust II Invesco NASDAQ 100 ETF
CUSIP: 46138G649
Recurring","Buy","1.438489","$208.55","($300.00)"
"1/2/2025","1/2/2025","1/3/2025","","ACH Deposit","ACH","","","$310.00"
"1/2/2025","1/2/2025","1/3/2025","VOO","Vanguard S&P 500 ETF
CUSIP: 922908363","Buy","0.4","$541.05","($216.42)"
""
"","","","","","","","","","The data provided is for informational purposes only. Please consult a professional tax service or personal tax advisor if you need instructions on how to calculate cost basis or questions regarding your specific tax situation. Reminder: This data does not include Robinhood Crypto or Robinhood Spending activity."
